id,slug,name,code,university,description,url,prerequisites,core_for_major,last_taught,instructor,learning_goals,criteria,topics
62,7DiAboIv5N,Human-Computer Interaction I,CPSC 481,University of Calgary,"Fundamental theory and practice of the design, implementation, and evaluation of human-computer interfaces. Topics include: principles of design; methods for evaluating interfaces with or without user involvement; techniques for prototyping and implementing graphical user interfaces.
This course may not be repeated for credit.",https://silvadasilva.github.io/CPSC481-2019W/en/#!index.md,"One of Software Engineering 300, 301 or Data Science 311.",False,"10/06/2014, 00:00:00",Tiago Da Silva (tiago.dasilva@ucalgary.ca),"Course Outcomes:Explain and reason with core concepts from human-computer interaction, design, psychology and cognitive science– such as affordances, signifiers, and “Recognition vs. Recall” – and describe existing interfaces based on these principles.Understand and apply specific user-centered design methods (for user research, ideation, prototyping and evaluation) to design problems and situations (e.g. task and goal centered system design, IDEO Method Cards).Generate design ideas grounded in user research, and rationalize the connection from a design concept back to observations of people’s real-world behavior.Prototype user interfaces using low-level (e.g., paper prototyping, pictives, storyboarding), mid-level (e.g., wire framing) and high-fidelity techniques (e.g., C#).Constructively evaluate and critique interfaces (e.g., via usability walkthroughs and design heuristics), identifying effective design elements, design weaknesses that require revision, and opportunities for improvement.Demonstrate design communication skills to present user research and design concepts to elicit criticism and feedback — including hand sketching, prototyping, personas, scenarios, as well as verbal, written, and video presentation.",Assignments: 0.12;Participation: 0.08;Project: 0.35;Midterm: 0.15;Final Exam: 0.3,"1: Introduction, Good interfaces, user centered design;2: Heuristic evaluation, user-centered design;3: Investigation, IDEO methods: look, ask, learn, try;4: Ideation, task-centered system design, task-centered system design: walkthrough;5: Sketching, sketching user experiences: the workbook, prototyping;6: Review, midterm;7: Design of everyday things, Design of everyday things, Design of everyday things, Design of everyday things;8: Information representation, introduction to usability evaluation;9: Visual design, usability evaluation, inspection evalation;10: Invited talks;11: Usability testing, Usability testing;12: Principles, guidelines, patterns, patterns presentations;13: Information visualization"
63,tpqPP5LIHP,Human-Computer Interaction II,CPSC 581,University of Calgary,"Intermediate and advanced topics and applications in human-computer interaction, to further one's skills for designing highly interactive human-computer interfaces.",https://pages.cpsc.ucalgary.ca/~sonny.chan/cpsc581/,CPSC 481 and consent of the Department.,False,"10/06/2015, 00:00:00",Sonny Chan and David Ledo,"This second undergraduate course in Human Computer Interaction concentrates on having students acquire skills in creative aspects of Interaction Design. It is an unusual course for computer science as it somewhat follows the structure of a design studio: students mostly learn by doing rather than by listening to lectures.Course outcomes:By the end of the course, students should be able to summarize the key stages of the design processBy the end of the course, students should be able to explain the purpose and importance of sketching in the design process.By the end of the course, students should be able to explore, refine, and communicate design ideas through use of sketching.By the end of the course, students should be able to apply design thinking to sketch and prototype solutions to a variety of real-world problems. By the end of the course, students should be able to debate the merits and limitations of alternative existing designs that address a given problemBy the end of the course, students should be able to demonstrate the ability to strengthen a peer’s design ideas through design critiqueBy the end of the course, students should be able to prepare an online portfolio that records and presents their work in an appealing manner.",Project: 0.6;Participation and Exercises: 0.15;Sketchbook: 0.15;Final Portfolio: 0.1,"1: Introduction, Motivating sketching practice, the sketchbook, Design boot camp;2: Descending the design funnel, web portfolios, WPF application programming;3: The review, design critique, Design exercise;4: sketching workshop, Radical participation briefing, design critique: touch technique, camera sampling, windows phone programming;5: Camera sampling exercise, design critique: sensor technique, Guest lecture, window phone sensors;6: Design critique: touch & sensor refinements, Input technologies and techniques;7: Design critique: breadth exploration, Physical Setching, phidgets programming;8: Design critique: physical sketches, Templates, photo tracing, design critique: depth exploration, storyboards, network programming;9: Personas, ubiquitous computing and proxemics, prototype critique;10: Principles of graphic design, design critique, microsoft Kinect programming;11: persona Presentations, design critique;12: Typefaces, typography;13: Review"
64,8HKIYAUjsn,Human Computer Interaction,SENG 310,University of Victoria,"Understanding human behaviour as it applies to user interfaces: work activity analysis, observational techniques, questionnaire administration and unobtrusive measures. Operating parameters of the human cognitive system, task analysis and cognitive modelling techniques and their application to designing interfaces. Interaction design principles and prototyping techniques. Evaluation techniques including cognitive walkthroughs, usability studies and verbal protocol analysis are used to evaluate interface design. Case studies of specific user interfaces.",https://heat.csc.uvic.ca/coview/course/2019051/SENG310,"One of SENG 221, SENG 265, CENG 241, ECE 241.",False,"10/06/2019, 00:00:00",Charles Perin,"Establish target users, functional requirements, and interface requirements for a given computerized applicationDescribe and explain user interface design principles, and apply them to designing an interfaceDevelop preliminary interface designs using rapid prototyping methodsEvaluate user interface qualityDevelop user studies and analyze study data to gain information about users, tasks, and interface designsChoose appropriate HCI methods for specified goals and justify the choices madeUnderstand emerging topics in HCI research",project: 0.4;Assignments: 0.2;In class/lab activities: 0.1;Midterm Exams: 0.3,
65,CWShYFzIk9,Advanced Methods for Human Computer Interaction,SENG 411,University of Victoria,"Laboratory course building on the interaction design process. Theory and application of advanced methods for design and evaluation, including interface prototyping and design techniques; experiments and observational studies both in the laboratory and in the field; methods for statistical and qualitative analysis. Advanced topics: underlying models of human computer interaction; new trends in interaction design; and research frontiers. Students undertake a major team project.",https://web.uvic.ca/calendar2019-05/CDs/SENG/411.html,"SENG 310; and one of STAT 252, STAT 254, STAT 255, STAT 260",False,"10/06/2011, 00:00:00",Melanie Tory,,,"1: Field Studies, Observation, Qualitative analysis, participatory design laboratory experiments and statistical analysis, prototyping methods, eyetracking, log analysis;2: Participatory Design, ethnography, interation analysis, Foci, How people organize their desk(paper), An evaluation of a multiple interface design solution for bloated software;3: Roles of video in HCI part I, including prototyping, using video to prototype user interfaces;4: Roles of video in HCI part II;5: Experiments;6: Guest lecture:"
66,FqdCayUwFm,HUMAN-COMPUTER INTERACTION,Computer Science 4474A/B,Western University,"Exposure to topics in human-computer interaction, including: frameworks for human-computer interaction; requirements gathering; rapid prototyping; user interface systems and tool kits.",http://www.csd.uwo.ca/misc/outlines/2018/2018-cs4474-b.pdf,Computer Science 3307A/B/Y,False,"10/06/2018, 00:00:00",Dr. Kamran Sedig,"To identify and describe HCI concepts/terminology/issues used in the design and evaluation of interactive
computing systems
To design human-centered software, consciously incorporating and applying HCI principles in the design process
To evaluate the effectiveness of a piece of software in the light of the discussed HCI principles
To think deeply about users’ needs and distinguish the differences between system-centered design and humancentered design",Project: 0.37;Reading Assignments: 0.09;Design Studio activities: 0.24;Final: 0.3,
67,8rk1eBD0mY,Human-Computer Interaction 1,COMP 3020,University of Manitoba,"human factors and usability, user-centered design, prototyping, usability evaluation.",https://www.cs.umanitoba.ca/~comp3020/,"one of COMP 2140 or COMP 2061 (C). A course in cognitive psychology, such as PSYC 2480, is recommended",False,"10/06/2019, 00:00:00",Pourang Irani,,Assignments:: 0.3;Midterm:: 0.15;Final:: 0.5;Participation:: 0.05,"1: Introduction;2: Paradigms & History, Foundations (H);3: Usability Goals & Principles;4: Identifying Users, Requirements Gathering;5: Observations (in-class), Scenarios and Tasks, Prototyping;6: Sketching Workshop;7: Case Study, Layout, Layout/Midterm Review;8: Layout, Event Handling, Midterm;9: Input;10: Drawing/Visualization;11: Evaluation, Analytical (Cognitive Walkthrough), Heuristic Evaluation;12: Observing Users;13: Questionnaires/Interviews"
68,xAhoHedYeR,Human-Computer Interaction 2,COMP 4020,University of Manitoba,Advanced issues in the field of human-computer interaction. Topics will be selected from current research and development issues in the field of HCI.,https://www.cs.umanitoba.ca/~comp4020/,COMP 3020 (C). A course in cognitive psychology such as PSYC 2480 is recommended,False,"10/06/2017, 00:00:00",Andrea Bunt,,Assignments:: 0.05;Attendance and Participation:: 0.1;Project:: 0.45;Discretionary / Peer review:: 0.05;Final exam:: 0.35,"1: introduction;2: Field Studies;3: Field Studies;4: Field Studies;5: Prototyping: Sketching and Toolkits;6: Motor Processing;7: Design Reviews / Project Time;8: Experiments;9: Experiments;10: Experiments: Data analysis, Topics: Designing for Mobile Devices;11: Topics: Crowdsourcing;12: Topics: Ubiquitous Computing;13: Project Presentations"
69,BamEbxejtN,Human-Computer Interaction,LE/EECS 4441,York University,"Introduces the concepts and technology necessary to design, manage and implement interactive software. Students work in small groups and learn how to design user interfaces, how to realize them and how to evaluate the end result. Both design and evaluation are emphasized.",https://www.eecs.yorku.ca/course_archive/2018-19/F/4441/,"cumulative GPA of 4.50 or better over all major EECS courses (without second digit ""5""); LE/EECS 2030 3.00 or LE/EECS 1030 3.00; LE/EECS 3461 3.00. Previously offered as: LE/CSE 4441 3.00",False,"10/06/2018, 00:00:00",Scott MacKenzie,,Assignments:: 0.1;Project proposal: 0.1;Project report: 0.4;Midterm: 0.2;Final exam:: 0.2,"1: Historical Perspective;2: The human factor;3: The human factor;4: The human factor, Edinburg Handedness Inventory;5: The human factor, Interaction elements;6: linear regression;7: Interaction elements;8: Interaction elements;9: scientific foundation;10: experiment, scientific experiment;11: hypotesis testing;12: Modeling Interaction;13: Writing and publishing research paper"
70,fDLbxitgHq,HUMAN-COMPUTER INTERFACE DESIGN,CS/IT 321,University of Prince Edward Island,"Fundamental theory and practice in the design, implementation, and evaluation of human-
computer interfaces. Topics include: principles of design, methods for evaluating interfaces with or
without user involvement, techniques for prototyping and implementing graphical user interfaces.",,CS 1920,False,"10/06/2019, 00:00:00","Scott Bateman, PhD",,Assignments:: 0.15;Midterm:: 0.15;Final:: 0.35;Participation:: 0.1;Project: 0.25,
71,UnOoAaMTRz,HUMAN-COMPUTER INTERACTION,CSCI 6420U,University of Ontario Institute of Technology,"This course is about the human side of computing: human-computer interaction. The focus of
the course is on the design and evaluation of usable and useful interactive computational
interfaces which enhance and support the cognitive, communicative, and creative capacities of
people. The course introduces research methods used to gain holistic and in-depth knowledge
about tasks, mental models, and contexts, in order to design interfaces which are responsive
and supportive. The course will discuss the economic, safety, and productivity consequences of
poorly designed interaction techniques and interfaces. Building on design thinking developed
through case studies and critique exercises, the course will also introduce several interface
implementation technologies and standards, across a variety of computing modalities and
contexts, including desktop, web, mobile, gesture, virtual reality, and multi-touch hardware. Basic knowledge of HTML and Java is assumed. Classes will consist of lectures based on the course readings, relevant videos, and discussions of late-breaking research. Lab sessions will
review the data gathering methods, programming techniques, experimental methodologies, and
algorithms needed to complete the assignments, as well as allow students time to work with
specialized hardware required for some assignments.",,,False,"10/06/2014, 00:00:00",Dr. Christopher Collins,"Describe a typical process used to understand people and contexts, enumerate tasks and requirements, and to evaluate the success of implemented interfaces.Critique interactive interface design using well-founded theoretical explanations.Recognize the impact of human-computer interaction in everyday life situations.Implement universal design techniques and apply standards for universal accessibility.Apply principles of good interface design in the creation of small scale systems.Work in small teams on a multi-step project.Write and speak clearly about issues and challenges in hardware and software interface design, specific challenges uncovered during their term project.Apply general mathematical models in the assessment of interaction technique efficiency and effectiveness.",Assignments:: 0.3;Midterm:: 0.2;Final:: 0.22;Participation:: 0.03;Project: 0.45,
72,Cu4aAUx7h4,HUMAN-COMPUTER INTERACTION,CMPT 481/811,University of Saskatchewan,"Fundamental theory and practice in the design, implementation, and evaluation of human-computer interfaces.",,,False,"10/06/2019, 00:00:00",Dr. Regan Mandryk,"Read and critique the seminal work on human-computer interaction.Practice the skills of ideation, low-fidelity prototyping, and medium-fidelity prototyping.Evaluate the usability of a system through techniques that do not involve the end user (e.g., heuristic evaluation) and those that do involve an end user (e.g., controlled user studies).Iterate on an interface using the results of the evaluation.Implement an interface, using the skills of ideation, prototyping, and evaluation.Present and communicate their interface and evaluation through a project report, project presentation, and project video – similar to how human-computer interaction research and case studies are presented in the community.",Assignments:: 0.15;Midterm:: 0.2;Final:: 0.3;Participation:: 0.05;Project: 0.3,
73,TTIKidPXO1,sag,688074,University of Saskatchewan,sfd,https://www.google.com/,a,True,"12/28/2019, 00:00:00",sadf,safd,,
